### ISSUE TITLE
SIP SIMPLE outgoing message does not honour port unless SIP proxy is configured.

### ISSUE THREAD

**Issue by GoogleCodeExporter** [sonuarya/csipsimple#2727]
```
What steps will reproduce the problem?
1. setup SIP server on non-default port (i.e. 5080/UDP)
2. setup csipsimple
3. setup another client (i.e. microsip)
4. send SIMPLE message from other client to csipsimple (arrives)
5. reply to this message from csipsimple

What is the expected output? What do you see instead?
Expected to see mesage sent from csipsimple delivered at other client, but 
instead the message does not arrive. Network trace shows csipsimple sending 
packets to port 5060.

What version of the product are you using? On what device / operating
system?
1.02.00 r2330 on hammerhead (N5) android

Please provide any additional information below.
- Server is FreeSWITCH 1.2.23 running with mod_sms configured for TCP/UDP 5080
- Registration URI in CsipSimple is configured for port 5080. However, there is 
no general port setting for a given account.
- network trace below; 1.1.1.1 being the SIP server, 2.2.2.2 being the 
csipsimple client, 1111 being the other client sending a message, 2222 being 
csipsimple again.

15:15:36.101949 IP 1.1.1.1.5080 > 2.2.2.2.46096: UDP, length 711
MESSAGE sip:2222@2.2.2.2:23154 SIP/2.0
Via: SIP/2.0/UDP 1.1.1.1:5080;rport;branch=z9hG4bK9tBFDB9HeF01N
Route: <sip:2222@2.2.2.2:23154>;ob
Max-Forwards: 70
From: "MicroSIP user" 
<sip:1111@sip.domain.com>;tag=0c924a2897914ab1b925f86a01e47ead
To: <sip:2222@2.2.2.2:23154>;ob
Call-ID: 333932b5-69bd-429e-a43e-4a2f07817ed6
CSeq: 61208810 MESSAGE
Contact: <sip:1.1.1.1:5080>
User-Agent: FreeSWITCH-mod_sofia/1.2.23~64bit
Allow: INVITE, ACK, BYE, CANCEL, OPTIONS, MESSAGE, INFO, UPDATE, REGISTER, 
REFER, NOTIFY, PUBLISH, SUBSCRIBE
Supported: timer, path, replaces
Content-Type: text/plain
Content-Length: 4
X-FS-Sending-Message: f399503f-03c1-40ae-a45c-be6bc7cc15d9

test
15:15:36.438741 IP 2.2.2.2.46096 > 1.1.1.1.5080: UDP, length 355
SIP/2.0 200 OK
Via: SIP/2.0/UDP 
1.1.1.1:5080;rport=5080;received=1.1.1.1;branch=z9hG4bK9tBFDB9HeF01N
Call-ID: 333932b5-69bd-429e-a43e-4a2f07817ed6
From: "MicroSIP user" 
<sip:1111@sip.domain.com>;tag=0c924a2897914ab1b925f86a01e47ead
To: <sip:2222@2.2.2.2>;tag=z9hG4bK9tBFDB9HeF01N;ob
CSeq: 61208810 MESSAGE
Content-Length:  0


15:18:31.530854 IP 2.2.2.2.46096 > 1.1.1.1.5060: SIP, length: 480
MESSAGE sip:1111@sip.domain.com SIP/2.0
Via: SIP/2.0/UDP 
2.2.2.2:46096;rport;branch=z9hG4bKPjJfH0cPev.N7zo9QTi0oDjnz.1qnVwtj-
Max-Forwards: 70
From: "CsipSimple user" 
<sip:2222@sip.domain.com>;tag=-rS0Qbtdh9EO7bJFEqtUcMGylcJCaC.z
To: <sip:1111@sip.domain.com>
Call-ID: 0CqgZsl6lTev2zQJvFOSlmcMr4RuQKOr
CSeq: 8130 MESSAGE
Accept: text/plain, application/im-iscomposing+xml
User-Agent: CSipSimple_hammerhead-19/r2330
Content-Type: text/plain
Content-Length:     9

test back


After configuring the SIP proxy settings to sip.domain.com:5080, it does work.
```

Original issue reported on code.google.com by `miche...@gmail.com` on 18 Jun 2014 at 1:50
